job_title,job_description
Procurement Manager,"Supplier diversity programs Diversity and inclusion initiatives Supplier assessment and certification Data collection and reporting Vendor outreach and engagement Strategic planning Communication skills Relationship building Attention to diversity and inclusion principles Promote diversity and inclusion in the supply chain, manage supplier diversity programs, and assess supplier performance."
Architectural Designer,Architectural drafting AutoCAD 2D and 3D modeling Blueprint reading Building codes Collaboration with architects Detail-oriented Architectural Drafters assist architects and engineers in creating detailed technical drawings and plans for buildings and structures. They use comput
Art Teacher,"Art education curriculum Program development Teacher training Communication skills Artistic expertise An Art Education Coordinator plans and manages art education programs, curriculum development, and educational outreach to promote art appreciation an"
Environmental Consultant,"Environmental impact analysis Data collection and analysis Environmental regulations Reporting GIS (Geographic Information Systems) Technical writing Environmental Impact Analysts assess the environmental consequences of projects or activities. They conduct studies, analyze data, and provide recomme"
Event Planner,"Wedding planning Venue selection Catering and menu planning Floral and decor design Wedding etiquette Wedding Planners specialize in organizing weddings, assisting couples with every aspect of wedding planning, from venue selection to catering and deco"
Architect,"Architectural design software (e.g., AutoCAD, Revit) Building codes and regulations 3D modeling Visualization Sustainable design Architectural Designers create architectural plans and designs for buildings and structures, considering aesthetics, functionality, and safety standar"
Family Lawyer,Mediation Conflict resolution Negotiation Communication skills Neutrality Problem-solving Legal knowledge Mediation techniques Mediators facilitate negotiations and dispute resolution between parties in conflict. They remain neutral and help parties reach mutually acceptable a
Account Manager,"Client relationship management Customer service Communication skills Build and maintain strong client relationships, understand their needs, and ensure client satisfaction."
Business Development Manager,"Market expansion strategies Market research Sales planning and execution A Market Expansion Manager strategizes and executes plans to expand the companys presence in new markets, identifying growth opportunities and optimiz"
Network Engineer,"Network management Troubleshooting Network security IT certifications (e.g., CCNA) Network Administrators manage an organizations computer networks. They configure, monitor, and maintain network infrastructure, ensuring optimal perfo"
IT Manager,"Network administration System administration Virtualization technologies (e.g., VMware, Hyper-V) Storage management IT security Disaster recovery planning Capacity planning Monitoring and troubleshooting Cloud infrastructure (e.g., AWS, Azure) Vendor management An Infrastructure Manager is responsible for the operation and maintenance of an organizations IT infrastructure, including servers, networks, and dat"
HR Coordinator,"Training program coordination Training material development Learning management systems Training Coordinators design and implement employee training programs. They assess training needs, develop training materials, and facilitate training"
Human Resources Manager,"Employee conflict resolution HR compliance Employee engagement Communication skills Employee Relations Specialists focus on maintaining positive relationships between employees and the organization. They address workplace issues, cond"
Customer Support Specialist,Help desk support Ticket resolution IT troubleshooting Customer service skills Technical knowledge Documentation and knowledge base maintenance Communication and interpersonal skills Help Desk Analysts provide technical support and assistance to internal employees or external customers. They troubleshoot hardware and software issue
Content Writer,"Content strategy Content planning SEO optimization Content marketing Analytics Content Strategists develop and execute content strategies that align with business objectives. They plan content creation, distribution, and promotio"
Network Administrator,"Network security protocols Intrusion detection and prevention Security incident response Firewall administration Vulnerability assessment Security policies and procedures Log analysis Ethical hacking Problem-solving Communication skills Attention to detail Protect an organizations computer networks and systems from security threats, monitor network traffic, and respond to incidents."
Chemical Analyst,"Quality control Quality assurance QC testing methods Compliance standards Root cause analysis Documentation Statistical analysis In the role of a Quality Control Analyst, you will be responsible for inspecting and testing products to ensure they meet quality standards and specif"
Psychologist,"Clinical psychology Counseling skills Assessment tools Diagnostic skills Empathy and listening skills Clinical Psychologists diagnose and treat mental health disorders. They conduct therapy sessions, assessments, and research to improve patients well-b"
Software Engineer,"Proficiency in one or more backend programming languages (e.g., Java, Python, Node.js, Ruby) API development Database management (SQL or NoSQL) Server management and deployment Security best practices Knowledge of web frameworks (e.g., Express, Django) A Backend Developer is tasked with building and maintaining the server-side logic and database infrastructure of web applications. They work on the co"
Physician Assistant,"Medical knowledge and clinical skills Patient care and assessment Communication and empathy Provide medical care under the supervision of physicians, conduct examinations, diagnose and treat patients."
Financial Advisor,"Investment strategies Portfolio management Financial planning Risk assessment Regulatory compliance Investment Advisors offer financial advice to clients, helping them make investment decisions, manage portfolios, and achieve their financial goals."
Litigation Attorney,"Litigation Legal research Courtroom representation Case preparation Client counseling Legal writing Trial Attorneys represent clients in legal proceedings. They prepare cases, conduct trials, and provide legal counsel to clients involved in civil or "
Front-End Developer,"Web design concepts Graphic design software (e.g., Adobe Creative Suite) HTML and CSS Responsive design User interface (UI) principles Visual communication Typography Color theory Creativity Attention to detail Collaboration A Web Designer specializes in designing visually appealing and responsive websites. They create layouts, graphics, and user interfaces to enhance the "
IT Support Specialist,"Technical troubleshooting Customer service and communication Ticketing system usage Basic IT knowledge Problem-solving and critical-thinking skills Help Desk Support Specialists provide technical assistance and support to end-users, resolving IT issues and ensuring smooth operations."
Paralegal,"Legal research Discovery management Case preparation Trial support Document review Client communication E-filing Attention to detail Multitasking Legal terminology Technology proficiency Communication skills Legal software proficiency Assist in litigation cases, including document preparation, legal research, and trial support."
Legal Counsel,"Corporate law and regulations Contract drafting and negotiation Legal research and analysis Risk management Excellent communication and negotiation skills Corporate Attorneys provide legal counsel and representation to organizations. They handle legal matters, contracts, mergers, acquisitions, and ensure"
UX/UI Designer,"UI design principles and best practices Graphic design tools (e.g., Adobe Photoshop, Illustrator) Typography and color theory Visual design and layout Responsive design User Interface Designers focus on the visual and interactive aspects of digital interfaces. They design layouts, buttons, and other elements to ensure"
Social Media Coordinator,"Content creation (e.g., writing, editing, graphic design, video production) Content marketing Social media management SEO optimization Creative storytelling Audience engagement Analytics and reporting Adaptability Communication skills Creativity Create engaging and relevant content, such as articles, videos, or social media posts, to promote brands or products."
Tax Consultant,"Business tax law knowledge Corporate tax planning Tax compliance for businesses Tax credits and incentives Tax strategy development Financial analysis IRS regulations Client relationship management Communication skills Tax software proficiency A Business Tax Consultant specializes in tax planning and compliance for businesses. They assist with tax strategy, filings, and help organizations mi"
Electrical Designer,"Electrical engineering Circuit design Electronics AutoCAD proficiency Problem-solving Electrical Engineers design and develop electrical systems and devices. They work on projects such as power generation, electronics, and control syste"
UX Researcher,"User research methods Usability testing Data analysis and interpretation Conduct user research to understand customer needs, preferences, and behaviors to inform product development."
Systems Administrator,"Technical troubleshooting Hardware and software support Customer service Problem-solving Communication IT Support Specialists provide technical assistance to end-users, troubleshooting hardware and software problems, setting up equipment, and maintainin"
Customer Service Manager,"Quality assurance Quality control Process improvement Audit procedures Compliance standards Root cause analysis Service Quality Assurance Managers monitor and evaluate service quality in an organization. They develop quality standards, conduct audits, analyze cu"
UI Developer,User experience (UX) design User interface (UI) design Wireframing and prototyping Usability testing Design tools like Sketch or Figma A UX/UI Designer focuses on enhancing user experiences by designing intuitive interfaces. They consider user needs and preferences to create visually 
Sales Associate,"Customer service Sales techniques Product knowledge Cash handling Communication skills A Retail Sales Associate assists customers in retail environments, helping them find products, providing product information, and ensuring a positive "
Mechanical Engineer,"Manufacturing processes knowledge CAD/CAM software proficiency Lean manufacturing principles Quality control and assurance Six Sigma certification Manufacturing Engineers optimize manufacturing processes, improve production efficiency, and ensure product quality in manufacturing environments."
HR Manager,"Strategic HR planning Employee relations Talent management HR policy development Leadership skills A Human Resources Director leads HR functions, including talent acquisition, employee development, and HR strategy, to promote a positive work environ"
Environmental Engineer,"Sustainability practices Environmental management systems Green certifications A Sustainability Specialist promotes sustainability initiatives within organizations, develops sustainability programs, and helps reduce environmental"
Office Manager,"Administrative leadership Office management Staff supervision Budgeting and financial management Process improvement Communication skills Administrative Managers oversee office operations. They manage administrative staff, coordinate tasks, and ensure smooth office functioning to support"
Marketing Analyst,"Digital marketing strategies Analytics and reporting SEO and SEM Social media marketing Email marketing Data interpretation Marketing automation tools A/B testing Communication skills Problem-solving Attention to detail Marketing knowledge Analyze digital marketing campaigns, track performance metrics, and optimize online marketing strategies."
Network Analyst,"Network performance analysis Network monitoring tools (e.g., Wireshark) Troubleshooting Capacity planning Data analysis Network protocols Network Performance Analysts monitor and optimize network performance. They collect and analyze network data, identify issues, and implement solutions"
Civil Engineer,"Structural engineering principles Structural analysis and design software (e.g., AutoCAD, SAP2000) Building codes and standards Project management Structural integrity assessment A Structural Engineer designs and analyzes the structural integrity of buildings, bridges, and other structures. They ensure safety and compliance wit"
Digital Marketing Specialist,"Social media platforms (e.g., Facebook, Twitter, Instagram) Content creation and scheduling Social media analytics and insights Community engagement Paid social advertising Social Media Managers oversee an organizations social media presence. They create and schedule content, engage with followers, and analyze social medi"
Landscape Architect,Landscape design Plant selection and care Hardscape design Create aesthetically pleasing and functional landscape designs for residential properties.
Legal Secretary,"Knowledge of court procedures Legal document management Attention to detail Computer literacy Organization skills A Court Clerk manages administrative tasks within a court system, including maintaining court records, scheduling hearings, and assisting judges and l"
Financial Analyst,Financial analysis Investment evaluation Portfolio management Data analysis Investment Analysts analyze financial data and market trends to make informed investment recommendations. They research and assess investment opportun
Veterinarian,"Exotic animal medicine Exotic animal diagnostics Specialized surgical skills Avian medicine Reptile care Amphibian care Exotic animal anesthesia Compassion and empathy Client communication Problem-solving Attention to detail Provide medical care and treatment to exotic animals, diagnose illnesses, perform surgeries, and educate owners on animal care."
Software Tester,"Test automation tools (e.g., Selenium, Appium) Scripting languages (e.g., Python, Java) Test framework development Continuous integration tools Test data management An Automation Tester uses automated testing tools to verify the functionality and performance of software applications. They create and execute automa"
Project Coordinator,"Construction project management Building codes and regulations knowledge Budgeting and cost control Construction scheduling Contractor and subcontractor coordination Construction Project Coordinators assist in managing construction projects, handling documentation, budget tracking, and coordinating subcontractors."
QA Analyst,"Test automation Test framework development Continuous integration Scripting languages (e.g., Python) Test reporting Code review Automation Test Engineers develop automated test scripts and frameworks to streamline and enhance the testing process. They focus on automating repeti"
Systems Engineer,"Cloud systems engineering Cloud infrastructure (e.g., AWS, Azure) DevOps practices Automation Security in the cloud Disaster recovery Scalability As a Cloud Systems Engineer, you will be responsible for designing, implementing, and managing cloud infrastructure solutions. You will work with clou"
Occupational Therapist,"Geriatric assessment and evaluation Geriatric-specific occupational therapy techniques Aging-related conditions (e.g., dementia, arthritis) Fall prevention strategies Care coordination with healthcare teams Assistive technology for seniors Patient advocacy Empathy and compassion Communication skills A Geriatric Occupational Therapist works with elderly individuals to address age-related health issues and maintain independence and quality of life."
Structural Engineer,"Bridge design Civil engineering Structural analysis AutoCAD proficiency Project management A Bridge Engineer specializes in designing and maintaining bridges, ensuring their structural integrity, safety, and compliance with engineering stand"
Public Relations Specialist,"Crisis communication planning Crisis response Media relations Reputation management Stakeholder communication Crisis Communication Managers develop strategies to manage and respond to crises, maintaining the organizations reputation during challenging times."
Systems Analyst,"Business systems analysis Requirements gathering Process improvement A Business Systems Analyst analyzes business processes and requirements, recommends technology solutions, and bridges the gap between business objecti"
Interior Designer,Commercial interior design Workplace ergonomics Building codes and regulations knowledge Sustainable design principles AutoCAD and Revit proficiency A Commercial Interior Designer focuses on designing interior spaces for businesses and commercial properties. They optimize layouts for productivity a
Substance Abuse Counselor,"Addiction recovery support Motivational interviewing Relapse prevention strategies A Recovery Coach offers guidance and support to individuals in addiction recovery, aiding in their journey toward sobriety and helping them build a st"
Investment Analyst,Risk assessment Data analysis Financial modeling Risk management tools Regulatory compliance knowledge A Risk Analyst assesses and manages financial risks within an organization. They use data analysis and modeling to evaluate potential risks and recomm
Finance Manager,"Treasury management Cash flow analysis Risk management Financial forecasting Banking relations Treasury Managers manage a companys treasury operations. They oversee cash management, investments, and financial risk management to maintain liquidit"
Network Technician,"Network security Cybersecurity Intrusion detection Security analysis Firewall management Network Security Specialists focus on network security. They implement security measures, monitor for threats, and respond to security incidents to pr"
Mechanical Designer,"HVAC system design Load calculations Energy efficiency AutoCAD or similar software Mechanical engineering principles Collaboration with architects and engineers Regulatory compliance Problem-solving Attention to detail Communication skills Design and optimize heating, ventilation, and air conditioning (HVAC) systems for buildings, focusing on energy efficiency and comfort."
Sales Manager,"Sales leadership Team management Sales strategy and planning Lead and motivate sales teams, set sales targets, and develop sales strategies to meet goals."
Data Analyst,"Data analysis and visualization tools (e.g., Tableau, Power BI) SQL and database querying Business intelligence concepts Data modeling and reporting Strong analytical and problem-solving skills Data-driven decision-making Business Intelligence Analysts gather and analyze data to provide valuable insights to support decision-making within an organization. They create rep"
Marketing Manager,"Digital marketing strategies SEO and SEM Social media marketing Email marketing campaigns Content marketing Web analytics (e.g., Google Analytics) Marketing automation tools (e.g., HubSpot, Marketo) Digital Marketing Managers lead digital marketing efforts, including SEO, SEM, social media, email marketing, and content strategy. They develop and e"
Financial Controller,"Accounting Financial reporting Financial audits Tax compliance Accounting software (e.g., SAP, Oracle) GAAP (Generally Accepted Accounting Principles) Accounting Controllers manage an organizations accounting and financial reporting functions. They ensure accurate financial records, compliance with a"
Procurement Specialist,"Sourcing strategies Supplier evaluation Market research Cost analysis Contract negotiation Sourcing Analysts research and analyze potential suppliers, evaluate procurement strategies, and negotiate contracts to secure cost-effective and qual"
Project Manager,"Agile methodologies Scrum or Kanban Team collaboration Agile tools (e.g., Jira) The Agile Project Manager leads Agile teams, facilitating effective project development and delivery. They use Agile methodologies to manage tasks, pr"
Purchasing Agent,"Inventory control Demand forecasting Supply chain management Data analysis Warehouse management An Inventory Manager oversees inventory levels, coordinates stock movements, and optimizes inventory control procedures to ensure efficient stock mana"
Java Developer,"Java programming Java frameworks (e.g., Spring) Object-oriented design Code debugging Software development Problem-solving skills Java Software Engineers develop and maintain software applications using the Java programming language. They write code, debug applications, and colla"
Event Manager,"Event planning Conference logistics Budget management Vendor coordination Marketing and promotion Client relations A Conference Manager coordinates and manages conferences, meetings, and events. They plan logistics, handle budgeting, liaise with vendors, and ensure"
Marketing Coordinator,"Event planning and management Budgeting and financial management Vendor and sponsor relations Promotion and publicity Event logistics and coordination skills Event Marketing Coordinators focus on marketing events, including trade shows, exhibitions, and product launches, to maximize attendance and engagemen"
Graphic Designer,"Print design software (e.g., Adobe InDesign, Illustrator) Layout and composition Print production processes Color theory and management Attention to detail Print industry knowledge Print Graphic Designers design graphics and layouts for printed materials such as brochures, posters, and packaging. They use their creativity and des"
Network Security Specialist,"Cybersecurity Security assessments Intrusion detection Security tools (e.g., SIEM) Incident response Vulnerability scanning Cybersecurity Analysts protect computer systems and networks from cyber threats. They monitor security systems, investigate breaches, and implement se"
Electrical Engineer,"Electrical engineering Power system analysis Renewable energy systems Control systems Safety regulations Power Systems Engineers design and maintain electrical power systems. They work on generation, transmission, and distribution of electrical power, foc"
Chemical Engineer,"Quality control processes Quality assurance standards (e.g., ISO) Statistical analysis Inspection techniques Documenting quality issues Root cause analysis Communication with production teams Problem-solving Attention to detail Technical knowledge Monitor and maintain product quality standards, perform inspections, and implement quality control procedures."
Legal Advisor,"In-house counsel Legal advisory Employment law Intellectual property Regulatory compliance Dispute resolution Contract review Client counseling In the role of In-House Counsel, you will provide legal support to the organization across various areas, including contracts, employment law, and reg"
Process Engineer,"Chemical engineering Process design Chemical reactions Safety protocols Laboratory techniques Problem-solving skills Chemical Engineers design and oversee processes for the production of chemicals and related products. They conduct experiments, analyze data, and deve"
Front-End Engineer,"JavaScript programming Frontend development Frontend frameworks (e.g., React, Angular) DOM manipulation AJAX Debugging and troubleshooting JavaScript Developers write code to create interactive and dynamic web applications. They use JavaScript libraries and frameworks to build client-side"
Executive Assistant,"Office administration and management Budgeting and expense tracking Team coordination and supervision Facility management Vendor and supplier relations Office Managers oversee daily office operations, including supervising staff, managing facilities, and ensuring efficient workflow. They may also hand"
Marketing Director,"Brand strategy Brand development Creative direction Brand management Market research Brand Directors oversee brand management and strategy. They ensure brand consistency, guide marketing initiatives, and work to enhance brand perceptio"
Procurement Coordinator,"Procurement Supplier management Negotiation Supply chain management Inventory control Vendor relations Purchasing Coordinators manage procurement processes. They source and purchase goods and services, negotiate with suppliers, and ensure cost-effective"
Database Developer,"SQL (Structured Query Language) Database design Query optimization Data modeling Database maintenance Problem-solving skills SQL Database Developers design, implement, and maintain relational databases using SQL (Structured Query Language). They write queries, optimize datab"
Social Media Manager,"Social media analytics tools (e.g., Google Analytics, Facebook Insights) Data analysis and reporting Social media ROI measurement Competitive analysis Trend identification Social Media Analysts analyze social media data and metrics to provide insights and recommendations for improving social media strategies. They track "
Registered Nurse,"Nursing leadership Charge nurse responsibilities Team coordination A Charge Nurse leads and supervises nursing staff, coordinates patient care, and ensures efficient operations within a healthcare unit or department."
Technical Writer,"Writing skills Content creation SEO knowledge Research skills Grammar and proofreading Content Writers create written content for various platforms. They produce articles, blog posts, and web content to inform, educate, or entertain audi"
