job_title,job_description
Event Coordinator,"Event planning and coordination Budget management Vendor negotiation Venue selection and management Timeline and logistics planning Marketing and promotion Risk management Client communication Creativity Problem-solving Attention to detail Plan and coordinate events, including selecting venues, managing budgets, arranging logistics, and ensuring a successful outcome."
Family Nurse Practitioner,"Pediatric healthcare Pediatric assessment Pediatric treatment Patient education Pediatric pharmacology Pediatric Nurse Practitioners specialize in pediatric care. They provide healthcare to children, including diagnosis, treatment, and preventive care."
Dental Hygienist,Periodontal therapy procedures Patient care and communication Dental instrumentation Periodontal disease management Oral health education A Periodontal Therapist specializes in treating gum diseases and conditions. They perform procedures such as scaling and root planing to improve oral 
SEO Analyst,"Technical SEO Website audits SEO tools (e.g., Screaming Frog, Ahrefs) Schema markup Site speed optimization XML sitemaps Canonicalization As a Technical SEO Analyst, your role is to analyze website performance and identify opportunities for optimization. You will work on improving site s"
Pediatrician,"Pediatrics Pediatric care Diagnosis and treatment Pediatric medical procedures Patient care Communication skills General Pediatricians provide medical care to infants, children, and adolescents. They diagnose and treat various pediatric conditions, offer preventi"
Brand Manager,Product branding and marketing Product lifecycle management Cross-functional team collaboration Product launch planning Market segmentation and targeting A Product Brand Manager focuses on promoting and managing the brand identity of specific products or product lines within a companys portfolio.
Research Analyst,"Market research methodologies Data collection and analysis Consumer behavior analysis Competitor analysis Survey design and analysis Statistical analysis software (e.g., SPSS, SAS) Data visualization Trend analysis Report writing Communication skills Attention to detail A Market Research Analyst gathers and analyzes data to provide insights into market trends, consumer behavior, and competitive landscapes. They help b"
SEO Specialist,"Search engine optimization Keyword research SEO tools (e.g., Google Analytics, SEMrush) On-page and off-page optimization SEO Analysts optimize websites for search engines, conduct keyword research, analyze performance metrics, and implement strategies to improve search r"
Inventory Analyst,"Inventory management Stock control Demand forecasting Inventory tracking systems Supply chain coordination Problem-solving skills Inventory Control Specialists manage and optimize inventory levels in a business. They track stock, monitor demand, and implement inventory control pr"
Market Analyst,Competitive analysis Market research Data analysis Business strategy Industry knowledge Competitive Intelligence Analysts gather data on competitors and industry trends. They analyze information to help businesses make informed decisions 
Administrative Assistant,"Calendar management Travel coordination Meeting scheduling Correspondence and communication Office organization Confidentiality Time management Problem-solving Attention to detail Communication skills Technology proficiency (e.g., MS Office) Support high-level executives by managing schedules, coordinating meetings, and handling various administrative tasks."
Data Entry Clerk,"Records management Data entry and retrieval Attention to detail A Record Keeper is responsible for maintaining accurate records and databases, ensuring data integrity, and assisting in data retrieval when needed."
Account Director,"Account management Client relations Marketing strategies Campaign optimization Data analysis Communication skills Account Strategists work in advertising or marketing agencies, managing client accounts. They develop strategies to meet client goals, oversee campaig"
Teacher,"Teaching pedagogy Classroom management Curriculum development Student assessment Differentiated instruction A Classroom Teacher educates students in a specific subject or grade level. They create lesson plans, deliver instruction, assess student progress, an"
Legal Assistant,"Legal research Document drafting Case management E-filing Legal databases (e.g., LexisNexis) Client communication Deposition preparation Trial support Ethics and confidentiality Attention to detail Communication skills Legal software proficiency Assist lawyers with legal research, document preparation, and case management in law firms or legal departments."
Physical Therapist,"Orthopedic assessment and treatment Rehabilitation exercises Patient education Provide physical therapy services to patients with orthopedic conditions, rehabilitate injuries, and improve mobility."
Sales Representative,"Sales strategy and planning Account management Customer relationship management Solution selling Sales forecasting Contract negotiation Sales metrics and reporting Account Executives manage and grow relationships with existing clients or customers. They understand client needs, propose solutions, negotiate contra"
Marketing Specialist,"Content strategy Content creation Blog management Content promotion SEO Analytics and reporting Content Marketing Managers oversee the creation and distribution of content to attract and engage customers. They develop content strategies, manage c"
Social Worker,"School social work principles Student assessment and intervention Special education laws Individualized education plans (IEPs) Crisis management Collaboration with educators Family engagement Advocacy Empathy and communication Documentation Cultural competence Licensing and certification Support students social and emotional well-being in schools, collaborate with educators, and connect families with resources."
Investment Banker,"Financial analysis Data analysis Financial modeling A Financial Analyst conducts financial analysis, generates reports, and provides insights to support decision-making, budgeting, and financial plannin"
Urban Planner,"Transportation planning Traffic engineering GIS proficiency Public transportation Project management Transportation Planners design and manage transportation systems. They optimize traffic flow, plan public transit routes, and enhance overall transpor"
Web Developer,"Frontend and backend development Database integration Problem-solving API knowledge Full-Stack Developers are skilled in both frontend and backend development. They can work on all aspects of web application development, from creating"
Software Architect,"Cloud computing platforms (AWS, Azure, etc.) Cloud security Containerization (Docker, Kubernetes) A Cloud Architect designs and manages cloud-based solutions, optimizing scalability, security, and performance while aligning them with the companys t"
Pharmaceutical Sales Representative,"Sales techniques and strategies Relationship building CRM software usage Product knowledge Negotiation and closing skills Sales Representatives promote and sell products or services to customers, build relationships, and meet sales targets through effective communication "
Brand Ambassador,"Brand promotion Marketing knowledge Communication skills Sales techniques Product knowledge Brand Promoters are responsible for promoting a companys brand or products. They engage with the target audience, create marketing strategies, and bui"
Speech Therapist,Pediatric speech therapy Speech-language assessment Individualized treatment plans Child development Communication skills Pediatric Speech Therapists provide speech therapy to children with speech and language disorders. They assess and treat communication difficulties to
Wedding Planner,"Wedding design concepts Decor selection and arrangement Creative flair A Wedding Designer specializes in creating visually appealing wedding designs and décor, transforming wedding venues into beautiful and memorable spac"
Quality Assurance Analyst,"Test automation frameworks and tools Scripting and programming languages (e.g., Python, Java) Continuous integration and continuous testing (CI/CT) Test script development and maintenance Test environment setup and management Test Automation Engineers automate testing processes using scripts and tools. They design and maintain automated test suites to streamline testing eff"
IT Administrator,"System administration Network administration Troubleshooting Security management Server maintenance Backup and recovery System Administrators manage and maintain computer systems and networks. They handle software installations, security measures, and troubleshooting to"
Research Scientist,"Data collection and analysis Market research tools and techniques Survey design and analysis Qualitative and quantitative research methods Report writing and presentation skills Research Analysts conduct research, collect data, and analyze information to support business decision-making. They generate reports and recommendatio"
Operations Manager,"Supply chain logistics and management Inventory control and procurement Supplier relationship management Data analysis and forecasting Risk assessment and mitigation Supply Chain Managers manage the end-to-end supply chain process, from procurement to distribution. They optimize logistics, reduce costs, and ensure "
Art Director,"Creative leadership Art direction Concept development Visual design Advertising and marketing expertise Creative Directors lead creative teams in developing visual and conceptual designs for various media, ensuring brand consistency and artistic quality."
Data Engineer,"Big data technologies (Hadoop, Spark, etc.) Data processing and analysis Distributed computing A Big Data Engineer develops and manages big data solutions, including data storage, processing, and analysis platforms, to extract valuable insights "
Software Developer,"Mobile app development languages (e.g., Java, Swift, Kotlin) Cross-platform development (e.g., React Native, Flutter) Mobile app design principles APIs and web services integration Debugging and troubleshooting Mobile App Developers design and develop mobile applications for various platforms. They collaborate with cross-functional teams to create user-friend"
Database Administrator,"Database design and development SQL and database querying Data modeling Programming languages (e.g., Java, Python) Data security and privacy regulations knowledge A Database Developer designs, develops, and maintains databases. They create efficient data structures, write queries, and ensure data security and in"
Business Analyst,"Business process analysis Requirement gathering Data analysis Communication skills IT Business Analysts bridge the gap between business needs and technology solutions. They analyze business processes, gather requirements, and create "
Nurse Manager,"Clinical nursing Patient assessment Care planning Staff development Healthcare protocols Communication skills Problem-solving abilities Clinical Nurse Managers lead and supervise nursing staff in clinical settings. They coordinate patient care, manage resources, and support nursing tea"
Customer Success Manager,Customer service Problem-solving Communication skills Ticketing system usage Product knowledge A Customer Support Specialist assists customers with inquiries or issues related to a companys products or services. They provide solutions and mainta
Email Marketing Specialist,"Email deliverability best practices Spam filter testing List hygiene Blacklist monitoring Email authentication (e.g., SPF, DKIM) Deliverability metrics analysis Troubleshooting deliverability issues Communication skills Data analysis Attention to detail Monitor and improve email deliverability rates, troubleshoot delivery issues, and maintain a clean email list."
Nurse Practitioner,"Family medicine Health assessment Pediatric care Chronic disease management Patient education Family Nurse Practitioners specialize in family-centered healthcare, providing comprehensive medical care to individuals of all ages within a family c"
Account Executive,"Advertising and marketing knowledge Client relationship management Advertising campaign development Budget management Media planning and buying An Advertising Account Executive works in advertising agencies, managing client accounts and overseeing the creation and execution of advertising camp"
Data Scientist,"Machine learning algorithms Python programming Data preprocessing Deep learning Model evaluation Machine Learning Engineers develop machine learning models and algorithms, working on tasks like data preprocessing, model training, and deployment."
Web Designer,"Frontend web development HTML/CSS Responsive design User interface (UI) design Adobe Creative Suite Collaboration skills Frontend Web Designers create the visual elements and user interfaces of websites. They use HTML, CSS, and JavaScript to design responsive, user-frien"
Market Research Analyst,"Market research coordination Survey design and administration Data analysis A Market Research Coordinator supports market research initiatives by organizing and managing research projects, data collection, and analysis efforts"
Customer Service Representative,"Live chat support Online customer communication Problem resolution A Live Chat Support Agent provides customer support through live chat channels, addressing inquiries, troubleshooting issues, and offering timely solu"
SEM Specialist,"Search engine marketing (SEM) Google Ads Bing Ads Keyword analysis Ad performance analysis SEM strategy development Bid management SEM Analysts analyze search engine marketing (SEM) campaigns. They monitor performance, optimize keyword strategies, and provide insights to improve t"
Landscape Designer,"Landscape architecture Site planning Plant selection Environmental sustainability AutoCAD Project management Commercial Landscape Architects design outdoor spaces for commercial properties, such as office complexes and retail centers. They create functional a"
Personal Assistant,"Administrative support Calendar management Communication skills Time management Organizational skills Confidentiality Personal Secretaries provide administrative support to individuals or executives. They manage schedules, handle correspondence, and assist with variou"
Supply Chain Analyst,"Supply chain analysis Data analytics Inventory management Transportation planning Problem-solving A Logistics Analyst analyzes and optimizes logistics and supply chain operations, identifying cost-saving opportunities, improving transportation effi"
Accountant,"Forensic accounting Fraud detection Legal knowledge Investigative skills Forensic Accountants investigate financial discrepancies and fraud. They analyze financial documents, track financial transactions, and provide expert"
Supply Chain Manager,Demand forecasting Inventory management Data analysis Sales and operations planning (S&OP) ERP software proficiency A Demand Planner analyzes historical sales data to forecast future demand for products. They work to optimize inventory levels and ensure product avai
Product Manager,"Agile product development Scrum or Kanban frameworks Backlog management User story writing Prioritization techniques Collaboration with development teams Product vision and strategy Agile Product Owners work closely with development teams in Agile environments. They define and prioritize product backlog items, communicate the prod"
Copywriter,"Technical writing Documentation User manuals Technical specifications Industry-specific terminology Research skills Technical Copywriters create content that explains complex technical concepts in a clear and accessible manner. They often write user manuals, product"
HR Generalist,"Human resources Recruitment Employee onboarding HRIS (HR Information Systems) Record keeping Communication skills HR Coordinators assist in HR functions such as recruitment, onboarding, and employee record maintenance. They often handle administrative tasks, organ"
Product Designer,"Industrial design principles CAD and 3D modeling Prototyping and testing An Industrial Designer creates and improves product designs, focusing on aesthetics, functionality, and user experience to produce innovative and mark"
Sales Consultant,"B2B sales Business-to-business sales strategies Lead generation Sales negotiations Client relationship building Market research B2B Sales Consultants specialize in business-to-business sales. They identify and target potential corporate clients, negotiate contracts, and build l"
Investment Advisor,"Financial planning Investment knowledge Relationship management Communication skills Analytical skills Wealth Advisors provide financial advice to clients. They assess financial goals, create investment strategies, and offer guidance on wealth managemen"
Financial Planner,"Tax planning strategies Tax law knowledge Financial analysis Retirement planning Estate planning Client relationship management Tax optimization Communication skills Attention to detail Tax software proficiency Regulatory compliance Assist clients with tax planning, minimize tax liabilities, and stay up-to-date with tax laws and regulations."
Back-End Developer,"Server-side programming languages (e.g., Java, Python) Database management API development A Server Developer specializes in developing and maintaining server-side applications and systems, ensuring efficient data processing and server funct"
Aerospace Engineer,"Aerospace engineering CAD software (e.g., AutoCAD) Aerodynamics Structural analysis Aircraft systems Safety regulations Aircraft Design Engineers design and develop aircraft systems and structures. They work on aircraft components, propulsion systems, and aerodynamics t"
QA Engineer,"Quality assurance Process improvement Team leadership Problem-solving Quality control A QA Manager is responsible for leading and managing the quality assurance team. They ensure product quality, develop and implement QA processes, and "
Key Account Manager,"Account management Client relationship Sales strategy Business development Negotiation skills Strategic Account Managers nurture relationships with key clients. They develop account strategies, address client needs, and seek opportunities for b"
